Title,URL,Score,Subreddit,Selftext,Created_Date_Time,Created_Date,Category
What was the hardest hit thrown against Gretzky?,https://www.reddit.com/r/nhl/comments/1bv3k70/what_was_the_hardest_hit_thrown_against_gretzky/,208,nhl,"I know he usually had on-ice protection and respect for being a clean, gentlemanly player, but did he ever get laid out Scott Stevens style?

Edit: found clips of two big hits on Gretz

https://youtu.be/kI1O3ocxaQE?si=kPitY02rsSma8uXI thanks u/Tom_Brady6969

https://youtu.be/5E6FggzXz3I?si=T38znrqWD3-xj2NC this one he leaves the game ",2024-04-03 20:37:56,2024-04-03,hot
Slafkovsky on Nick Cousins’ cheapshot behavior,https://v.redd.it/vvo70av9wasc1,336,nhl,,2024-04-03 17:38:28,2024-04-03,hot
Your most underrated players in the NHL?,https://www.reddit.com/r/nhl/comments/1bw3o2e/your_most_underrated_players_in_the_nhl/,1,nhl,,2024-04-05 00:15:35,2024-04-05,hot
Maple leafs,https://www.reddit.com/r/nhl/comments/1bw3aso/maple_leafs/,0,nhl,Just curious. New to hockey. I was wondering why on social media that most nhl fans love when the maple leafs loose. Is it the players? The organization? The fans?,2024-04-04 23:59:42,2024-04-04,hot
Is this a suspension according to DOPS?,https://v.redd.it/gdpyoio47asc1,395,nhl,,2024-04-03 15:17:38,2024-04-03,hot
Condolences to Boone Jenner,https://www.reddit.com/r/nhl/comments/1buz6a1/condolences_to_boone_jenner/,246,nhl,"As someone who has also lost a child on the day of birth, I am saddened anytime this happens to anyone. I didn’t deal with my grief until it dealt with me years later. I hope the Blue Jackets offer him, his wife, and family all the time and support they are going to need. They are humans first and hockey players down the line. ",2024-04-03 17:51:27,2024-04-03,hot
What’s the lowest +/- of a team that made the playoffs?,https://www.reddit.com/r/nhl/comments/1bwa9cv/whats_the_lowest_of_a_team_that_made_the_playoffs/,0,nhl,"Seeing Washington at -38 only a point out of the playoffs made me wonder, anyone know?",2024-04-05 05:32:12,2024-04-05,hot
Bro loves talking,https://v.redd.it/rjcjqwz54csc1,111,nhl,,2024-04-03 21:45:30,2024-04-03,hot
Pietrangelo has a bright future as a soccer player!,https://v.redd.it/1cuon2u6zasc1,196,nhl,,2024-04-03 17:55:46,2024-04-03,hot
Does anyone have a link for the Sportsnet intermission last night?,https://www.reddit.com/r/nhl/comments/1bvz7wh/does_anyone_have_a_link_for_the_sportsnet/,0,nhl,Been searching on reddit and twitter for what Jen Botterill said but there's no video anywhere that I can find.. Is it not allowed to be posted? I see older clips but nothing from 24 hours. Seeing a lot of comments about it but just want to see or read what was said. Thanks!,2024-04-04 21:18:39,2024-04-04,hot
I made a discord that post all scores/standings/news & even shows live goals and current updated news come check it out,https://www.reddit.com/r/nhl/comments/1bvwv7p/i_made_a_discord_that_post_all/,0,nhl,https://discord.gg/nhl,2024-04-04 19:49:51,2024-04-04,hot
2 points!,https://v.redd.it/vyh8otmmvcsc1,34,nhl,I think Marner gets at least an assist here.,2024-04-04 00:18:17,2024-04-04,hot
In remembrance..Joe Flaherty,https://youtu.be/VmaG3qb1Saw?si=8ZNEmXRoCaj9se7U,23,nhl,Not to mention John Candy,2024-04-04 02:16:27,2024-04-04,hot
"Do you think whoever finishes 5th in Hart voting will have no 1st, 2nd, 3rd or 4th place votes on any individual ballot?",https://www.reddit.com/r/nhl/comments/1bvvo9v/do_you_think_whoever_finishes_5th_in_hart_voting/,0,nhl,"No matter which order you have them in, Kucherov, MacKinnon, McDavid and Matthews are the consensus top 4 for the Hart to the point where they don’t list anyone else to bet on in most places. Whether you don’t think Matthews belongs with the top 3 or not, he’d still easily be the No. 4 guy for almost everyone.   

For voting for the award though, the writers have to list out their 1st, 2nd, 3rd, 4th and 5th place choices in order, with all individual ballots added up with a points system of 10-7-5-3-1. So if there are 200 individual ballots and say Panarin is 5th on all 200, he’d get 200 points. If a player is 1st on every ballot they would get 2,000 total points.     

Since the NHL went to a 1st-5th system in 1996, the highest finish for a player receiving nothing but 5th-place votes was Stamkos in 2022, when he was 11th place overall, receiving six 5th-place votes on the 195 total ballots.   

Given the clear separation of the top 4, as well as ballots being made public (which will let people see which writers elevated another player to knock down one of MacKinnon/McDavid/Kucherov/Matthews), do you think whoever finishes 5th this year will just be an accumulation of whoever gets the most 5th place votes, or do you think we’ll see someone outside of the big 4 receive votes between 1st-4th on a ballot as well?   

Usually I’d say there would be a few oddball votes, especially when you’re dealing with nearly 200 ballots, but with it being a particularly contentious year, if someone knocks one of the 4 down it could realistically cost that player the Hart just based on that one ballot, with voting likely being very tight in the top 3 in particular.",2024-04-04 19:05:27,2024-04-04,hot
A month ago they were a lottery team and weren’t in the race. The real race is still 894,https://i.redd.it/ei8c8yr0rksc1.jpeg,0,nhl,,2024-04-05 02:46:41,2024-04-05,hot
"Despite threats from the NHL, Fleury wears Native American mask",https://v.redd.it/p5sglg7wge2c1,27058,nhl,,2023-11-25 01:52:43,2023-11-25,top
The Boston Bruins Blew A 3-1 Lead,https://i.redd.it/g6zuf87q36xa1.jpg,15769,nhl,,2023-05-01 01:54:13,2023-05-01,top
Is this poor sportsmanship?,https://v.redd.it/uc6awdpohvhc1,12984,nhl,,2024-02-11 03:12:35,2024-02-11,top
Haha happening right now.,https://i.redd.it/a7f3sb6c5de41.jpg,10291,nhl,,2020-02-01 19:24:11,2020-02-01,top
Florida isn't afraid of hate,https://i.redd.it/ifypayxtolpa1.jpg,9154,nhl,,2023-03-23 21:46:09,2023-03-23,top
Not all heroes wear capes.,https://i.redd.it/dd76fkovykxa1.jpg,9026,nhl,,2023-05-03 03:53:46,2023-05-03,top
My great Grandfathers game worn jersey from the 1949 Stanley cup finals,https://i.redd.it/evq1pqunvsz91.jpg,8803,nhl,,2022-11-13 23:09:38,2022-11-13,top
"After years of cheap shots, Nick Cousins finally gets punched",https://v.redd.it/x6h4un5owmkc1,7681,nhl,,2024-02-25 01:31:42,2024-02-25,top
Love wins,https://i.redd.it/u9vxxjcoitoa1.jpg,7543,nhl,,2023-03-19 23:01:45,2023-03-19,top
This entire sub going to jail,https://i.redd.it/w9f2crctn23b1.jpg,7361,nhl,,2023-05-30 20:44:29,2023-05-30,top
My 13 yr old just told me Eichel looks like Marv…she’s not wrong,https://i.redd.it/snkhqor1gw3b1.jpg,7048,nhl,,2023-06-04 00:54:24,2023-06-04,top
Al Powers (@powersimagery) may have just captured one of the greatest sports photos of the modern age.,https://i.redd.it/2jnp778cq86b1.png,7017,nhl,,2023-06-15 20:22:26,2023-06-15,top
Quinton Byfield scores an absolutely UNREAL goal.,https://v.redd.it/qea44jmy9vjc1,6564,nhl,,2024-02-21 04:33:34,2024-02-21,top
Bedard Michigan's Binnington,https://v.redd.it/xfklrf9lb58c1,6475,nhl,,2023-12-24 01:30:49,2023-12-24,top
"Following a hat trick in a 9-2 win over the Habs, Alex Ovechkin posed for a picture with his opponent’s moms.",https://i.redd.it/895vm3m0ek9a1.jpg,6218,nhl,Credit to ‘Habs Fan TV’ on Twitter.,2023-01-02 00:18:01,2023-01-02,top
Helmet denied,https://www.reddit.com/gallery/182y008,6166,nhl,,2023-11-24 18:01:55,2023-11-24,top
"Not my video, but my thoughts exactly. 5k fine for this is a joke.",https://v.redd.it/qn98zvj5rcya1,6167,nhl,,2023-05-07 01:20:20,2023-05-07,top
Pretty much,https://i.reddituploads.com/818a4b144fcd445280f59c2c7cf4cb91?fit=max&h=1536&w=1536&s=2ee0e4f31e31b05a0aa0ea5cd35b8005,6125,nhl,,2017-02-05 18:35:22,2017-02-05,top
Ain't This the Truth,https://i.redd.it/aaf2hd31zl031.jpg,6034,nhl,,2019-05-26 19:38:10,2019-05-26,top
Kochetkov is a mad man,https://v.redd.it/nlynchs0bz5c1,6037,nhl,,2023-12-13 03:11:43,2023-12-13,top
One of the best ideas I’ve ever seen,https://i.redd.it/auzv4dwsx2l91.png,5915,nhl,,2022-08-31 16:57:32,2022-08-31,top
No more Pride jerseys in Chicago,https://i.redd.it/zpn75xt3efpa1.jpg,5817,nhl,,2023-03-23 00:35:22,2023-03-23,top
😮‍💨,https://i.redd.it/y1c5rsy0t0ic1.jpeg,5603,nhl,,2024-02-11 21:00:58,2024-02-11,top
Stanley Cupcakes,https://i.redd.it/5ykqxpplhbua1.jpg,5581,nhl,,2023-04-16 16:48:30,2023-04-16,top
Free sweaters at the Arizona Toronto game,https://i.redd.it/syx57o5bb39a1.jpg,5563,nhl,,2022-12-30 14:52:08,2022-12-30,top
An update from the lady who fell victim to Caron Briere's wheelchair antics,https://i.redd.it/g9u2yr7cedoa1.jpg,5516,nhl,,2023-03-17 16:48:57,2023-03-17,top
Wild pulled the goalie in 3 on 3 OT and won the game… wow,https://v.redd.it/bz9y289c3lnc1,5433,nhl,,2024-03-10 22:35:05,2024-03-10,top
Vegas Golden Knights become first NHL franchise to televise ALL games free for local market,https://www.ktnv.com/news/golden-knights/vegas-golden-knights-scripps-sports-announce-historic-broadcast-partnership,5232,nhl,"VGK reached a deal with Scripps Sports to televise all games to its local market, including over the air stations.",2023-05-05 14:39:47,2023-05-05,top
Snoop speaks facts,https://i.redd.it/gpxxnhpxoyxa1.jpg,5204,nhl,,2023-05-05 02:02:57,2023-05-05,top
Reimer skips Pride Night,https://i.redd.it/8f5nvtvgmloa1.jpg,5199,nhl,,2023-03-18 20:28:46,2023-03-18,top
Most civilized Lightning fans,https://v.redd.it/d5yimtemjh8c1,5184,nhl,,2023-12-25 18:37:35,2023-12-25,top
Rekt,https://i.redd.it/31gb7rh4cli41.jpg,5161,nhl,,2020-02-23 03:13:00,2020-02-23,top
why is gretzky never in conversation for anything sports related. hockey is so looked over and even laughed at!,https://i.redd.it/z605zcn6f2bc1.jpeg,5140,nhl,,2024-01-07 18:58:01,2024-01-07,top
This true?,https://i.redd.it/61gygicr5n3b1.jpg,4962,nhl,,2023-06-02 17:40:41,2023-06-02,top
"NHL: “sorry, we didn’t know 😉”",https://i.redd.it/jzkvdaqxsf091.jpg,4934,nhl,,2022-05-19 13:46:17,2022-05-19,top
Travis Kelce is passionate about the unwritten rules,https://i.redd.it/vq1prc8oi2ic1.jpeg,4831,nhl,,2024-02-12 02:46:29,2024-02-12,top
PATRICK KANE GETS THE OVERTIME WINNER ON THE BREAKAWAY IN CHICAGO!!!!!  ,https://v.redd.it/3h49pgk65ukc1,4757,nhl,,2024-02-26 01:49:04,2024-02-26,top
The NY Rangers suck!,https://i.redd.it/autp8pvnxbxa1.jpg,4761,nhl,,2023-05-02 02:31:38,2023-05-02,top
"Could have had Davy, got Buoy instead...",https://i.redd.it/wnocdrnw9hr91.jpg,4643,nhl,,2022-10-02 23:37:39,2022-10-02,top
So this arrived at my doorstep this morning...,https://i.redd.it/saqrdzpkpxe61.jpg,4631,nhl,,2021-02-01 21:30:54,2021-02-01,top
I Just Wanna Watch Fucking Hockey,https://i.redd.it/ch85nf6mngt91.png,4599,nhl,,2022-10-12 23:38:13,2022-10-12,top
Anaheim will bring back their Mighty Ducks jerseys,https://i.redd.it/f3lgf8t74t8b1.jpg,4561,nhl,,2023-06-28 19:03:25,2023-06-28,top
Matt Rempe and Nicolas Deslauriers drop the gloves.,https://v.redd.it/tjsew6w5elkc1,4466,nhl,,2024-02-24 20:23:32,2024-02-24,top
Lol,https://i.redd.it/mjvoezpq03011.jpg,4475,nhl,,2018-05-25 22:56:14,2018-05-25,top
Diverse aquatic life found at the bottom of the Pacific,https://i.redd.it/vkbrrxnl34x81.jpg,4447,nhl,,2022-05-02 19:12:17,2022-05-02,top
This would be insane (via albyox on Twitter),https://i.redd.it/oh50j4zkln171.jpg,4435,nhl,,2021-05-27 12:05:51,2021-05-27,top
Unreal drone shot at Winter Classic,https://v.redd.it/82udr7ewdv9c1,4344,nhl,,2024-01-01 18:14:47,2024-01-01,top
Minnesota is the latest team to ditch Pride jerseys,https://i.redd.it/d8xny4u7hgma1.jpg,4329,nhl,,2023-03-08 01:02:10,2023-03-08,top
Fish toss,https://v.redd.it/a4ul6gtf4w9c1,4289,nhl,,2024-01-01 20:44:50,2024-01-01,top
Do stuff....,https://i.redd.it/jzegd3w95j2z.jpg,4284,nhl,,2017-06-09 02:20:45,2017-06-09,top
My wife who hasn’t watched much hockey hates the two intermissions so I made her a meme,https://i.redd.it/7qingsrp93za1.jpg,4260,nhl,,2023-05-10 18:30:42,2023-05-10,top
Accurate,https://i.redd.it/vxyendnhspxa1.jpg,4244,nhl,,2023-05-04 01:06:54,2023-05-04,top
Happy Pride Month From The Staal Family,https://i.redd.it/a4clqmgwjh3b1.jpg,4162,nhl,,2023-06-01 22:49:39,2023-06-01,top
Remember that?,https://i.redd.it/w31jcio8zz5b1.jpg,4154,nhl,,2023-06-14 14:55:35,2023-06-14,top
Stop the spread of Coronavirus!,https://i.redd.it/6q71ubmm83l41.png,4151,nhl,,2020-03-06 17:34:05,2020-03-06,top
Jeff Malott leaves immediately after scoring game winning goal,https://v.redd.it/tvm4i51bpgk81,4146,nhl,,2022-02-27 23:41:57,2022-02-27,top
Interesting start to the Devils vs Rangers game.,https://v.redd.it/ax1wx31hkcsc1,4108,nhl,,2024-04-03 23:15:53,2024-04-03,top
Toronto fans react to game 1,https://v.redd.it/myxaoepovsua1,4103,nhl,,2023-04-19 03:19:32,2023-04-19,top
Tampa Bay reveals new uniforms,https://v.redd.it/qwfi0i7xiucc1,4095,nhl,,2024-01-16 18:35:13,2024-01-16,top
Property damage,https://v.redd.it/u02272cxnsma1,4081,nhl,,2023-03-09 18:01:48,2023-03-09,top
"Broadcasters shout out Aaron Rodgers in the crowd, fail to notice the great Neil Degrasse Tyson making faces at the camera",https://i.redd.it/9mvkpdr36zwa1.jpg,4070,nhl,,2023-04-30 02:35:24,2023-04-30,top
Seattle Kraken - End of Season Paint the ice day for Season Ticket holders,https://i.redd.it/80ljr0l4fp1b1.jpg,4065,nhl,,2023-05-23 23:08:30,2023-05-23,top
The Great One,https://i.redd.it/n8q9gxepg1jc1.jpeg,4028,nhl,,2024-02-17 00:17:51,2024-02-17,top
Gotta Love Playoff Hockey Scheduling,https://i.redd.it/urrlmk464wwa1.jpg,4021,nhl,,2023-04-29 16:18:53,2023-04-29,top
Update on the older Leafs fan whose hat was tossed by some loser,https://i.redd.it/ouqfeeilurjc1.jpeg,4008,nhl,,2024-02-20 17:02:00,2024-02-20,top
"Karl Subban, father to three former NHL players, calls for an end to sports betting ads | Day 6 | Live Radio | CBC Listen",https://www.cbc.ca/listen/live-radio/1-14-day-6/clip/15984474-karl-subban-father-three-former-nhl-players-calls?share=true,3974,nhl,,2023-05-18 12:39:04,2023-05-18,top
Fleury is now 2nd in all time wins,https://v.redd.it/e43pf41klpcc1,3912,nhl,,2024-01-16 02:02:08,2024-01-16,top
Stolen but funny,https://i.redd.it/kd87b7gtjn571.jpg,3896,nhl,,2021-06-16 16:12:26,2021-06-16,top
The images from the James Webb telescope are stunning.,https://i.redd.it/qik6wkuwk7b91.jpg,3859,nhl,,2022-07-12 16:52:31,2022-07-12,top
Dylan Larkin collapses after head contact,https://v.redd.it/15dp9h9x9d5c1,3860,nhl,,2023-12-10 01:08:21,2023-12-10,top
Nope. Didn't see that,https://v.redd.it/s7o3b9pozi671,3849,nhl,,2021-06-21 01:57:19,2021-06-21,top
Kraken things,https://i.redd.it/oddfn0lnjfwa1.jpg,3844,nhl,I am still gonna bet Colorado. Game six and seven if it happens,2023-04-27 08:35:23,2023-04-27,top
Ice Ice baby🏒🏒,https://v.redd.it/l90fuog297lc1,3792,nhl,,2024-02-27 21:53:59,2024-02-27,top
Nailed it,https://i.redd.it/n5fgw071wq681.jpg,3785,nhl,,2021-12-20 18:59:12,2021-12-20,top
27 years ago today,https://v.redd.it/5ptzbfsxmnzb1,3782,nhl,,2023-11-11 05:30:21,2023-11-11,top
Reaves and Rempe drop em' 🥊,https://v.redd.it/hqawpoyl81mc1,3778,nhl,,2024-03-03 02:44:53,2024-03-03,top
The Devils’ PR has a point.,https://i.redd.it/prfa95gderf61.jpg,3775,nhl,,2021-02-06 01:21:33,2021-02-06,top
There is just no comparison.,https://i.redd.it/evfcieug9t5b1.jpg,3769,nhl,Really puts things in perspective.,2023-06-13 16:20:27,2023-06-13,top
Nothing more to say.,https://i.redd.it/5ik6iu2rft4b1.jpg,3728,nhl,,2023-06-08 15:52:00,2023-06-08,top
"If only there was another letter in ""welcome"" that could have worked with the Flames logo",https://i.redd.it/een710e9pgv91.jpg,3733,nhl,,2022-10-22 20:55:40,2022-10-22,top
Which hybrid do you prefer,https://www.reddit.com/gallery/10jvs22,3685,nhl,,2023-01-24 03:18:00,2023-01-24,top
Most of Canada ATM,https://i.redd.it/pd147uxn7k131.png,3678,nhl,,2019-05-31 14:47:12,2019-05-31,top
Aube-Kubel falls and dents base of Stanley Cup,https://v.redd.it/twaxj2aa33891,3687,nhl,,2022-06-27 03:34:46,2022-06-27,top
PSA:,https://i.redd.it/jc5acgqlkl861.jpg,3676,nhl,,2020-12-31 22:16:51,2020-12-31,top
Sam Bennett hit of the year,https://v.redd.it/ekqndb71xw1b1,3656,nhl,,2023-05-25 00:23:14,2023-05-25,top
The most unserious minute of hockey,https://v.redd.it/0qet6504d1oc1,3649,nhl,,2024-03-13 05:18:50,2024-03-13,top
🥶🥶,https://i.redd.it/p85xlkzvj9491.jpg,3623,nhl,,2022-06-07 21:01:26,2022-06-07,top
Staal brothers will no longer participate in LGBT Pride night,https://i.redd.it/x2lbqlw09mpa1.jpg,3581,nhl,,2023-03-23 23:39:21,2023-03-23,top
Isn’t it obvious why this means so much to them?,https://i.redd.it/985mhcg0p2xa1.jpg,3506,nhl,,2023-04-30 14:26:23,2023-04-30,top
Shawn Thornton chirps are something else 🤣,https://v.redd.it/uzz1mqgcdfva1,3467,nhl,,2023-04-22 11:55:55,2023-04-22,top
Claude Provost. 9 Stanley Cups and 11 NHL All Star appearances. Not in the HOF.,https://i.redd.it/ugiiwmq8c4bb1.jpg,3454,nhl,,2023-07-10 10:56:15,2023-07-10,top
Oof,https://i.redd.it/bdseclqloqa61.jpg,3454,nhl,,2021-01-11 17:36:26,2021-01-11,top
I miss hockey so much I drove by a Buffalo Wild Wings just so I could boo three teams at once.,https://www.reddit.com/r/nhl/comments/fopirs/i_miss_hockey_so_much_i_drove_by_a_buffalo_wild/,3445,nhl,,2020-03-25 12:34:07,2020-03-25,top
Nice and snug.,https://i.redd.it/unvkdtuea1081.jpg,3436,nhl,,2021-11-16 22:28:41,2021-11-16,top
1 week into his NHL career,https://i.redd.it/82ruujjt86lc1.jpeg,3432,nhl,,2024-02-27 18:30:48,2024-02-27,top
Carey Price is the best goalie to never have won a Stanley Cup. What other goalie’s should have had a Cup?,https://i.redd.it/0ok8100mho7a1.jpg,3413,nhl,,2022-12-23 11:56:36,2022-12-23,top
Coyotes terminate Adam Ruzicka after he posts cocaine video on instagram ,https://v.redd.it/92pyvg0utekc1,3402,nhl,,2024-02-23 22:19:39,2024-02-23,top
NHL issues its ‘Don’t Say Gay’ policy with a ban on Pride Tape,https://www.outsports.com/2023/10/9/23907582/nhl-gay-lgbtq-pride-tape-drag-queen-national-anthem-player-boycott,3377,nhl,"Well, this sucks.  What bullshit.",2023-10-09 21:18:29,2023-10-09,top
I think we all know what the REAL NHL 16 cover should be.,http://i.imgur.com/mIwQpw5.png,3377,nhl,,2015-08-14 17:28:49,2015-08-14,top
"Is this team gear, or something registered offenders have to wear within 15 miles of a school?",https://i.redd.it/ysrnjsjdsmha1.jpg,3370,nhl,,2023-02-11 16:54:43,2023-02-11,top
