Title,URL,Score,Subreddit,Selftext,Created_Date_Time,Created_Date,Category
2010-11 Blackhawks that would still be second all time WIOS,https://i.redd.it/6vm5bufgissc1.jpeg,1,nhl,"Franchise hockey manager
(WIOS:Wiks in one season) 
kane had 112 points and toews has 56 plus minus",2024-04-06 04:52:58,2024-04-06,new
No way wtf.   ...we had it ,https://www.reddit.com/r/nhl/comments/1bx31v4/no_way_wtf_we_had_it/,1,nhl,Wtf happen last quarter    did our goalie choke last quarter ,2024-04-06 04:48:03,2024-04-06,new
Vegas gave up 6 goals in the 3rd period to the Yotes,https://i.redd.it/0hn76e45hssc1.jpeg,8,nhl,,2024-04-06 04:45:34,2024-04-06,new
Moments taken before disaster,https://www.reddit.com/gallery/1bx2yqr,7,nhl,,2024-04-06 04:43:06,2024-04-06,new
Just over 12 minutes left…,https://www.reddit.com/r/nhl/comments/1bx2xfg/just_over_12_minutes_left/,3,nhl,What the hell happened Vegas? You were up 4-1. ,2024-04-06 04:40:59,2024-04-06,new
Carlsson masterclass,https://v.redd.it/oykctqr0gssc1,1,nhl,,2024-04-06 04:40:04,2024-04-06,new
Top 10 photos taken moments before disaster,https://i.redd.it/0ngxu7x4gssc1.jpeg,4,nhl,,2024-04-06 04:39:57,2024-04-06,new
High end 07 player!,https://www.eliteprospects.com/player/947876/ricky-kwarciak,0,nhl,,2024-04-06 04:23:04,2024-04-06,new
What wild card be lookin’ like in the west,https://i.redd.it/v1uhg2zr9ssc1.jpeg,5,nhl,,2024-04-06 04:04:17,2024-04-06,new
Vegas is looking good if you don't look at that first period shots on goal.,https://i.redd.it/x9s6qj6o6ssc1.png,0,nhl,,2024-04-06 03:47:43,2024-04-06,new
Sabres Please Give Me Hope,https://www.reddit.com/r/nhl/comments/1bx1p7e/sabres_please_give_me_hope/,4,nhl,Jesus christ we beat the Capitols and now the Flyers. For the love of God don't let this be false hope again. Just make it to play offs. You don't have to win just make it to play offs. That's all I ask.,2024-04-06 03:35:09,2024-04-06,new
Shane Wright scores back to back goals,https://v.redd.it/hbduuolv1ssc1,13,nhl,,2024-04-06 03:21:14,2024-04-06,new
If I Owned Each NHL Franchise.,https://www.reddit.com/r/nhl/comments/1bx17v4/if_i_owned_each_nhl_franchise/,0,nhl,"Things I Would Change If I Owned Each Team.


ANA: Bring back old logo/jerseys.

ARI: Leave (Go To QC).

BOS: Give C to Pasta.

BUF: Arena upgrades, bring back Goat logo.

CGY: New arena, make Blasty main logo.

CAR: New branding, downtown arena

CHI: Keep logo, Black jerseys.

COL: Jersey upgrade

CBJ: More canons.

DAL: New Logo/Jerseys.

DET: Bring back old goal horn

EDM: Bring back cog jersey as alt.

FLA: New Miami arena

LAK: Bring back yellow/purple logo.

MIN: Jersey upgrades.

MTL: Arena exterior upgrades.

NSH: New jerseys

NJD: Jersey upgrades.

NYI: Jersey upgrades.

NYR: Liberty jersey as alternate.

OTT: Downtown arena.

PHI: Downtown arena.

PIT: Get back Fleury.

SJS: Arena Upgrades. Maybe move to SF.

SEA: Metropolitan jersey alternate.

STL: Add Gateway Arch to logo.

TBL: Jersey/logo upgrades

TOR: no

VAN: Arena upgrades, Skate jersey.

VGK: Better management.

WSH: New arena and branding.

WPG: Bigger arena, New jerseys.


Feel Free To Criticize Or Add Something.",2024-04-06 03:09:45,2024-04-06,new
Some conspiracy sheet going on if the scores turns out this way,https://www.reddit.com/gallery/1bx16rk,0,nhl,Google is doing some weird shit,2024-04-06 03:08:03,2024-04-06,new
Anybody else Google NHL scores showing 6-2 for oilers?,https://www.reddit.com/r/nhl/comments/1bx12ml/anybody_else_google_nhl_scores_showing_62_for/,6,nhl,,2024-04-06 03:01:56,2024-04-06,new
Ekholm deletes Rantanen,https://v.redd.it/5d66gmyfursc1,402,nhl,,2024-04-06 02:38:52,2024-04-06,new
Blacked Out,https://www.reddit.com/r/nhl/comments/1bx0cl1/blacked_out/,0,nhl,"Ducks v Kraken blacked out on the Center Ice package here in the Coachella Valley, 125+ miles, and a separate TV market, from LA. Usually not a problem as we would watch the Ducks broadcast via Bally Sports on Spectrum. BUT the Ducks are on KCOP, a local broadcast channel in LA, tonight  and not available on Spectrum here in the Coachella Valley. So Ducks fans here are out of luck AND Kraken fans who pay for the Center Ice package are also screwed. Idiots!",2024-04-06 02:25:31,2024-04-06,new
Dave Maloney throwing shade.,https://www.reddit.com/r/nhl/comments/1bx03hz/dave_maloney_throwing_shade/,1,nhl,"So during breaks in the game, MSG does, ""A Day In The Life of Steve Valiquette"" basically showing him setting up his stats for the game, etc. It's a commercial for CDW but about all the tech Vali uses.

After they come back from a break tonight, the legendary broadcaster Sam Rosen says to the legendary Blueshirt Dave Maloney (who was standing in for Joe Micheletti - Sorry for your loss Joe),   

""So Dave, would you like to live a day in the life of Steve Valiquette?""  
Dave replies, ""Cmon now. He's a goalie. What's going on up there?""   

LMAO

I will say this though, Valiquette is ridiculous with the stats, in a good way. ;)

PS, I was a goalie back in the day. Dave is right. We're really not all together up there.",2024-04-06 02:13:06,2024-04-06,new
Playoff race in the East rn,https://i.redd.it/19ojhmwwprsc1.jpeg,117,nhl,,2024-04-06 02:12:57,2024-04-06,new
Zach Benson’s stick explodes as he tries to end the game with an empty netter,https://x.com/sabresplays/status/1776420298595684483?s=46&t=EUQhUmF7oONsaf4ogDZu3w,25,nhl,,2024-04-06 01:45:36,2024-04-06,new
Bring back NHL 1-8 Playoff format! ,https://www.reddit.com/r/nhl/comments/1bwyrmw/bring_back_nhl_18_playoff_format/,6,nhl,https://chng.it/GsFpZHxPgH,2024-04-06 01:07:55,2024-04-06,new
The NHL needs to bring the playoff decal back this year,https://i.redd.it/59xhwsd26rsc1.jpeg,310,nhl,"The last few playoffs just haven’t felt the same without it, they haven’t had one since 2019 (technically 2020) and the playoffs from 2021-23 haven’t felt the same without it. I could understand why we didn’t have it in 2021 (we were honestly lucky we even got a season)  2022-23 there was no excuse to not have imo and it needs to make it’s return this year. I’m tiered of playoff hockey feeling like it’s still the regular season.",2024-04-06 00:21:42,2024-04-06,new
Best arena in your opinion and why?,https://www.reddit.com/r/nhl/comments/1bwxlbd/best_arena_in_your_opinion_and_why/,5,nhl,Just curious lol,2024-04-06 00:12:43,2024-04-06,new
#851,https://v.redd.it/ipve75193rsc1,89,nhl,,2024-04-06 00:05:58,2024-04-06,new
#850,https://v.redd.it/3uw3raix2rsc1,6,nhl,,2024-04-06 00:04:20,2024-04-06,new
New Artemi Panarin reference just dropped,https://v.redd.it/6vn7s39iyqsc1,57,nhl,,2024-04-05 23:39:43,2024-04-05,new
Playoff viewing. F' the nhl for gatekeeping it,https://www.reddit.com/r/nhl/comments/1bwwmr9/playoff_viewing_f_the_nhl_for_gatekeeping_it/,0,nhl,"How can I watch the playoffs??? WTF. The NHL isn't the NFL or MLB. Don't they want a new younger fan base? Let us watch it without all the shit. I have a lot of the streaming services, including YTTV and Paramount, hulu (not premium), etc but cannot watch the playoffs. WTF 

Gain viewership before you become an a\*#",2024-04-05 23:29:13,2024-04-05,new
Does anyone know where to find this?,https://i.redd.it/zutdyt1zvqsc1.jpeg,3,nhl,Saw someone on tiktok found this at the NHL shop in NYC and was wondering if anyone knows if it’s for sale on any website?,2024-04-05 23:25:08,2024-04-05,new
A slick goal off the goalie's face mask.,https://v.redd.it/rzsn64ltdpsc1,427,nhl,,2024-04-05 22:32:39,2024-04-05,new
How do I watch the DET / NYR game in Ontario ? ,https://www.reddit.com/r/nhl/comments/1bwv4l1/how_do_i_watch_the_det_nyr_game_in_ontario/,1,nhl,"This black out horse shit is getting old !!!! 

I live an hour from Detroit in Ontario. I want to watch this game tonight ….. any suggestions ?!? ",2024-04-05 22:26:22,2024-04-05,new
Stories behind the Masterton Trophy nominees?,https://www.reddit.com/r/nhl/comments/1bwtyd0/stories_behind_the_masterton_trophy_nominees/,3,nhl,Anyone know the stories behind the players nominated? Surprised the [nhl.com article](https://www.nhl.com/news/2023-2024-masterton-trophy-nominations-announced) doesn't have that.,2024-04-05 21:39:38,2024-04-05,new
Who has the best story for the Bill Masterson trophy?,https://www.reddit.com/r/nhl/comments/1bwt7ak/who_has_the_best_story_for_the_bill_masterson/,5,nhl,"With the NHL releasing the nominees for the Masterton trophy today, it got me wondering. Who won the trophy with the most incredible show of perseverance, sportsmanship and dedication? (Those last words are from the NHL)  
 And maybe, who didn't win but absolutely deserved to win?

&#x200B;",2024-04-05 21:09:48,2024-04-05,new
Player's preference ,https://www.reddit.com/r/nhl/comments/1bwrdjy/players_preference/,0,nhl,"I know all NHL players are competitive, they wouldn't be pros if they weren't. However, only 50% of the 32 teams make it to the playoffs. 

Which do you think most players really prefer, a chance at playing potentially 16-28 additional games before they start their shortened off-season break or enjoy their summer in their home/countries recovering from a grueling 8 month workload? ",2024-04-05 19:55:17,2024-04-05,new
Will he break 100…?,https://i.redd.it/qojypgddgpsc1.jpeg,270,nhl,,2024-04-05 18:35:55,2024-04-05,new
"Ryan: Forget about Charlie, Joel is your real brother! (Or a straight-up clone)",https://i.redd.it/72ag9xsr6psc1.png,24,nhl,,2024-04-05 17:49:46,2024-04-05,new
Coyotes Gameday Cover 04052023,https://i.redd.it/8hszd94d3psc1.jpeg,57,nhl,,2024-04-05 17:23:45,2024-04-05,new
"You're a GM, and this summer you get job offers from Buffalo, Ottawa, and Montreal. Which one are you taking? ",https://www.reddit.com/r/nhl/comments/1bwnbry/youre_a_gm_and_this_summer_you_get_job_offers/,92,nhl,,2024-04-05 17:07:36,2024-04-05,new
Jack Edwards,https://www.reddit.com/r/nhl/comments/1bwmbwh/jack_edwards/,0,nhl,"Needs to go immediately.

\-Sad bruins fan anxiously awaiting a first round exit, fulfilling the complete waste of Bergeron, Chara and Marchand's careers (except for one season that Tim Thomas carried)",2024-04-05 16:26:47,2024-04-05,new
Jonathan Drouin has officially crossed the 50 point threshold!,https://www.reddit.com/r/nhl/comments/1bwj5kz/jonathan_drouin_has_officially_crossed_the_50/,78,nhl,"What a season for him as he has 51 points in 73 games (17 g, 34 a) with a +/- of 11. Who knows if he resigns with the team as he may have priced himself out of COL like Burakovsky, Kadri, Rodrigues in the past
",2024-04-05 14:16:21,2024-04-05,new
Blue cheese or go f*** your mother,https://i.redd.it/jif57fvyynsc1.png,1510,nhl,,2024-04-05 13:50:07,2024-04-05,new
Natural hat trick ,https://www.reddit.com/r/nhl/comments/1bwhpni/natural_hat_trick/,0,nhl,"Quick question as me and some buddies were talking about this the other night. 

If a player (Bob let’s call him) was to score a goal in the first to make it 1-1 or whatever and than the other team scores 2 goals to make it 3-1. Bob were than to go out and score 3 in the third to make it 4-3. would it be considered a natural hat trick even thou he had already scored one previously. 

 or would his three goals together kinda overrule the hatrick and give him a natural hatrick stat ??",2024-04-05 13:13:10,2024-04-05,new
Playoff format proposal ,https://www.reddit.com/r/nhl/comments/1bwhb4m/playoff_format_proposal/,0,nhl,"League split in 8 divisions of four teams each.

Top two seeds plays each other in first round, winner of the series is considered champion of the division.

The 8 division champions are seeded based on regular season record 1-8, with 1v8, 2v7, 3v6 and 4v5.  

Same for third round highest v lowest, other two teams plays each other.

Last two teams plays in Stanley Cup Finals.

Yes this could introduce long travel in rounds 2 and 3, but vice versa we could have short travel for the finals.  And guaranteed really short travel for the first round.

This encourages rivalries to form outside the division, and potentially have rivalries play each other in the finals.",2024-04-05 12:54:25,2024-04-05,new
Playoff format,https://www.reddit.com/r/nhl/comments/1bwgqul/playoff_format/,0,nhl,"If the playoffs were to start today, because Dallas is the highest seed, they would play the lower wild card seed LA (who isn’t in their division), and the other wildcard Nashville (who is in their division) will play Vancouver (same division as LA). Does that make any sense? The highest getting the lowest seed makes sense when both wildcards are from the same division. But the whole point of this playoff format was to have divisional playoffs. Why not do that when the wildcards are from seperate divisions? As a Dallas fan I don’t want late night games in the first round.",2024-04-05 12:26:27,2024-04-05,new
NHL (VGK) player declared legally dead before trade deadline expects to be ready for Playoffs,https://thebeaverton.com/2024/04/nhl-player-declared-legally-dead-before-trade-deadline-expects-to-be-ready-for-playoffs/,1429,nhl,"Golden Knights player Connor Holmdenberg has announced he will be ready to play in Game 1 of the upcoming Stanley Cup Playoffs, despite the fact that he (and his 6.7 million dollar cap hit) was declared deceased by the team right before the NHL’s annual trade deadline back in March.

“Obviously when we reported to the league that Connor would need to be placed on LTIR due to his having passed away we did not expect him to be back in time for the playoffs,” said Knights GM Kelly McCrimmon. “But, thanks to Connor’s hard work and the expertise of our medical staff, we’re pleased to report that he will be alive again in time to help us chase another championship.”

“He definitely will still be dead during our last regular season game when the Salary Cap still exists though. That’s important to remember.”",2024-04-05 11:51:43,2024-04-05,new
Clint Malarchuk,https://i.redd.it/wylyq8o0gnsc1.jpeg,80,nhl,,2024-04-05 11:50:22,2024-04-05,new
Coyotes new arena/entertainment district concept,https://v.redd.it/6jqbgzrodnsc1,6,nhl,,2024-04-05 11:37:56,2024-04-05,new
Why are the Canadiens eliminated but not the Senators? Why are either eliminated? Both can achieve 84 points and the last wildcard team only has 83 points.,https://i.redd.it/0vzjsr3zkmsc1.png,60,nhl,,2024-04-05 08:57:16,2024-04-05,new
What’s the lowest +/- of a team that made the playoffs?,https://www.reddit.com/r/nhl/comments/1bwa9cv/whats_the_lowest_of_a_team_that_made_the_playoffs/,0,nhl,"Seeing Washington at -38 only a point out of the playoffs made me wonder, anyone know?",2024-04-05 05:32:12,2024-04-05,new
Free goal night in Ottawa,https://v.redd.it/pxgpb8ozjlsc1,7,nhl,,2024-04-05 05:29:47,2024-04-05,new
Plot twist,https://i.redd.it/8caf2l02dlsc1.jpeg,242,nhl,,2024-04-05 04:50:13,2024-04-05,new
"Metro is tight, who do you think will make it?",https://i.redd.it/03jkzhqa2lsc1.png,19,nhl,,2024-04-05 03:50:46,2024-04-05,new
"Where are my ""Crosby needs traded"" mouthpieces now?",https://www.reddit.com/r/nhl/comments/1bw7xgc/where_are_my_crosby_needs_traded_mouthpieces_now/,0,nhl,"Two weeks ago y'all telling me how we gotta trade Crosby because our team sucks and ruin his legacy of playing an entire career for the Penguins.

Well, here we are now and we got 3 in a row, just beat the capitals and are BACK!",2024-04-05 03:29:05,2024-04-05,new
Coyotes’ new home,https://v.redd.it/5hrogdkfvksc1,167,nhl,,2024-04-05 03:11:43,2024-04-05,new
Coyotes new arena confirmed?,https://www.reddit.com/r/nhl/comments/1bw7bx4/coyotes_new_arena_confirmed/,0,nhl,They just posted on their social media ,2024-04-05 03:00:13,2024-04-05,new
What’s the oldest a hockey player started playing hockey?,https://www.reddit.com/r/nhl/comments/1bw769d/whats_the_oldest_a_hockey_player_started_playing/,0,nhl,"Usually NHL hockey players start off young like 4 or 6, but has there been any hockey players that started when they were in middle school or even high school??",2024-04-05 02:52:32,2024-04-05,new
Sharks vs Kings camera angle,https://www.reddit.com/r/nhl/comments/1bw73y7/sharks_vs_kings_camera_angle/,0,nhl,Anyone else notice the camera angle isn’t right on TV? Seeing more empty seats than hockey. Maybe they hired a new camera guy? The camera movement is giving me a headache too. ,2024-04-05 02:49:39,2024-04-05,new
Eastern Wild Card race is wildin’!!!!,https://www.reddit.com/r/nhl/comments/1bw734k/eastern_wild_card_race_is_wildin/,4,nhl,And I’m all here for it!!!!,2024-04-05 02:48:39,2024-04-05,new
A month ago they were a lottery team and weren’t in the race. The real race is still 894,https://i.redd.it/ei8c8yr0rksc1.jpeg,0,nhl,,2024-04-05 02:46:41,2024-04-05,new
45 goals left to tie Gretzky,https://v.redd.it/n0qkdhfnmksc1,372,nhl,,2024-04-05 02:22:47,2024-04-05,new
"Stamkos hits teammate, Eyssimont jumps Xhekaj",https://v.redd.it/cz1utlqtlksc1,23,nhl,,2024-04-05 02:18:42,2024-04-05,new
Can Ryan Huska and Pierre McGuire get a DNA test please?,https://i.redd.it/nouy3reyhksc1.jpeg,25,nhl,,2024-04-05 01:55:53,2024-04-05,new
Stamkos takes out Hagel with big hit,https://v.redd.it/n92nr1tpgksc1,96,nhl,,2024-04-05 01:49:20,2024-04-05,new
NYI and PIT looking at WAS,https://i.redd.it/smh2kcgzeksc1.jpeg,48,nhl,,2024-04-05 01:39:13,2024-04-05,new
#849,https://v.redd.it/duyegf8tbksc1,582,nhl,,2024-04-05 01:21:50,2024-04-05,new
"What are the impactful differences in duties between Captain and Alternate Captain? Why is it best for a team that a very good and most long tenured player, like Mike Modano, is not designated as the Captain (I know he was but then he got switched back to Alternate)?",https://www.reddit.com/r/nhl/comments/1bw55p3/what_are_the_impactful_differences_in_duties/,2,nhl,Thanks!,2024-04-05 01:20:23,2024-04-05,new
Seems accurate,https://i.redd.it/mu3b49dmaksc1.jpeg,472,nhl,,2024-04-05 01:14:46,2024-04-05,new
Ottawa goaltending,https://v.redd.it/rkssn8qw7ksc1,52,nhl,,2024-04-05 00:59:49,2024-04-05,new
Espn is such a bunch of cucks. And need to respect players private lives. L,https://www.reddit.com/r/nhl/comments/1bw3vsp/espn_is_such_a_bunch_of_cucks_and_need_to_respect/,0,nhl,"Regardless whats posted by a player on social media. Not all things need to be blasted on a world wide scale.

No idea why they have a article on the EPSN + app about a players wife and their miscarriage.  What a classless dick tip someone must be to write that article.",2024-04-05 00:24:29,2024-04-05,new
Your most underrated players in the NHL?,https://www.reddit.com/r/nhl/comments/1bw3o2e/your_most_underrated_players_in_the_nhl/,1,nhl,,2024-04-05 00:15:35,2024-04-05,new
Straight Savage,https://v.redd.it/rnki1438xjsc1,1646,nhl,,2024-04-05 00:00:32,2024-04-05,new
Maple leafs,https://www.reddit.com/r/nhl/comments/1bw3aso/maple_leafs/,0,nhl,Just curious. New to hockey. I was wondering why on social media that most nhl fans love when the maple leafs loose. Is it the players? The organization? The fans?,2024-04-04 23:59:42,2024-04-04,new
NHL All Goat Game ,https://i.redd.it/bh0kjafivjsc1.jpeg,213,nhl,,2024-04-04 23:50:04,2024-04-04,new
Fans need to be louder,https://www.reddit.com/r/nhl/comments/1bw2e7x/fans_need_to_be_louder/,0,nhl,When I watch a nhl game the fans just sit there don't do anything cheer when a team scores maybe chant go team go which is honestly lame when you look at like the German hockey teams their fans go off they more then one chant they have songs for their teams and here in the NHL we are just there like we don't exist ,2024-04-04 23:22:03,2024-04-04,new
3 out of the 4 refs at the Habs - Lightning game are replacing other refs who couldn't make it because of the storm in Montréal,https://www.reddit.com/r/nhl/comments/1bw25lt/3_out_of_the_4_refs_at_the_habs_lightning_game/,6,nhl,"It's what RDS said, the French canadian broadcast. Thought it was pretty funny.",2024-04-04 23:12:23,2024-04-04,new
My friend's view of the Rags-Devils fight,https://v.redd.it/4vc2pi7wgjsc1,89,nhl,,2024-04-04 22:28:47,2024-04-04,new
Does anyone have a link for the Sportsnet intermission last night?,https://www.reddit.com/r/nhl/comments/1bvz7wh/does_anyone_have_a_link_for_the_sportsnet/,0,nhl,Been searching on reddit and twitter for what Jen Botterill said but there's no video anywhere that I can find.. Is it not allowed to be posted? I see older clips but nothing from 24 hours. Seeing a lot of comments about it but just want to see or read what was said. Thanks!,2024-04-04 21:18:39,2024-04-04,new
Ex-NHLer Bobby Ryan wages online war against women's sports,https://www.reddit.com/r/nhl/comments/1bvz7o6/exnhler_bobby_ryan_wages_online_war_against/,0,nhl,Bobby has gone for help before…looks like he needs it again.,2024-04-04 21:18:22,2024-04-04,new
I made a discord that post all scores/standings/news & even shows live goals and current updated news come check it out,https://www.reddit.com/r/nhl/comments/1bvwv7p/i_made_a_discord_that_post_all/,0,nhl,https://discord.gg/nhl,2024-04-04 19:49:51,2024-04-04,new
Nick Foligno’s sons at Blackhawks practice,https://v.redd.it/gma037mujisc1,1834,nhl,,2024-04-04 19:22:58,2024-04-04,new
"Do you think whoever finishes 5th in Hart voting will have no 1st, 2nd, 3rd or 4th place votes on any individual ballot?",https://www.reddit.com/r/nhl/comments/1bvvo9v/do_you_think_whoever_finishes_5th_in_hart_voting/,1,nhl,"No matter which order you have them in, Kucherov, MacKinnon, McDavid and Matthews are the consensus top 4 for the Hart to the point where they don’t list anyone else to bet on in most places. Whether you don’t think Matthews belongs with the top 3 or not, he’d still easily be the No. 4 guy for almost everyone.   

For voting for the award though, the writers have to list out their 1st, 2nd, 3rd, 4th and 5th place choices in order, with all individual ballots added up with a points system of 10-7-5-3-1. So if there are 200 individual ballots and say Panarin is 5th on all 200, he’d get 200 points. If a player is 1st on every ballot they would get 2,000 total points.     

Since the NHL went to a 1st-5th system in 1996, the highest finish for a player receiving nothing but 5th-place votes was Stamkos in 2022, when he was 11th place overall, receiving six 5th-place votes on the 195 total ballots.   

Given the clear separation of the top 4, as well as ballots being made public (which will let people see which writers elevated another player to knock down one of MacKinnon/McDavid/Kucherov/Matthews), do you think whoever finishes 5th this year will just be an accumulation of whoever gets the most 5th place votes, or do you think we’ll see someone outside of the big 4 receive votes between 1st-4th on a ballot as well?   

Usually I’d say there would be a few oddball votes, especially when you’re dealing with nearly 200 ballots, but with it being a particularly contentious year, if someone knocks one of the 4 down it could realistically cost that player the Hart just based on that one ballot, with voting likely being very tight in the top 3 in particular.",2024-04-04 19:05:27,2024-04-04,new
Never seen anyone switch up so quick. ,https://i.redd.it/w390rc21wgsc1.jpeg,0,nhl,,2024-04-04 17:54:48,2024-04-04,new
Minnesota Wild Point Total Wrong?,https://www.reddit.com/r/nhl/comments/1bvtog7/minnesota_wild_point_total_wrong/,0,nhl,"Before the game against the Golden Knights on Mar 30th, the WIld had 79 points. Vegas won in OT so the WIld should have gotten the loser point but they stayed at 79. Their point total didn't increase to their current 81 until they beat Ottawa on Apr 2nd. Am I missing something?",2024-04-04 17:49:46,2024-04-04,new
Bold Prediction from Editor-In-Chief: Two teams will make playoffs as second wild card.,https://i.redd.it/82a1ffsblhsc1.png,21,nhl,,2024-04-04 16:12:06,2024-04-04,new
Why do aging NHL players go play in Swiss Leagues?,https://www.reddit.com/r/nhl/comments/1bvqvp5/why_do_aging_nhl_players_go_play_in_swiss_leagues/,115,nhl,"I’m a noob to hockey and am just wondering why, for example, a player who’s been in the league for 6 years would go play in the Swiss B League after an unsuccessful free agency? 

Do players often come back from these leagues into the NHL? Or maybe it’s just for the love of the game? Some other reason? 

Referring to the player Scott Harrington. Big fan just curious what he’s doing over there. 

Thanks in advance. 


Edit: thanks for the info fam. Sounds like a nice gig.",2024-04-04 16:00:04,2024-04-04,new
Oilers defense masterclass,https://v.redd.it/6xznimie7hsc1,861,nhl,,2024-04-04 14:51:37,2024-04-04,new
"When I first read this, I genuinely thought his life was in danger",https://i.redd.it/8n5gy6kuvgsc1.jpeg,351,nhl,,2024-04-04 13:46:38,2024-04-04,new
Capitals' Tom Wilson Opens Up About High Stick On Leafs' Noah Gregor,https://thehockeynews.com/nhl/washington-capitals/takes/washington-capitals-tom-wilson-noah-gregor-suspension-appeal,65,nhl,,2024-04-04 12:39:15,2024-04-04,new
Why did Lazar and Vesey got only 5 minutes and not 5+10 in the fight?,https://www.reddit.com/r/nhl/comments/1bvi1gj/why_did_lazar_and_vesey_got_only_5_minutes_and/,0,nhl,,2024-04-04 08:30:51,2024-04-04,new
Highlights show?,https://www.reddit.com/r/nhl/comments/1bvhfmr/highlights_show/,2,nhl,"New to NHL and based in UK. Been following Flyers since seeing them live back in October. Quickly falling in love with the sport in general. I watch the flyers games live or recap through NHL TV. I'd like to watch some collated highlights and analysis of other games to get to know the game and the other teams more. The top 10 saves/goals/plays don't really do it. I'm looking for something more like Match of the Day in the UK which will show highlights of all the weekends football (⚽) games with some ""analysis"" after each game. Anything out there anyone can recommend?",2024-04-04 07:47:58,2024-04-04,new
