Title,URL,Score,Subreddit,Selftext,Created_Date_Time,Created_Date,Category
"I just read this and thought, ""What if Leon hadn't been sent to Kelowna?""",https://theathletic.com/1233406/2019/09/23/how-five-months-in-kelowna-changed-leon-draisaitls-hockey-career/,0,nhl,,2024-04-04 06:07:24,2024-04-04,new
Should the Canucks buy out Mikheyev this season?,https://www.reddit.com/r/nhl/comments/1bvf8r9/should_the_canucks_buy_out_mikheyev_this_season/,0,nhl,"Season stats before January 1st, 2024: 10 goals, 10 assists, +7 rating in 26 games played

Season stats after January 1st, 2024: 1 goal, 9 assists, -4 rating in 45 games played

Not to mention that I know he's at least been on the PP unit for several games this season, and yet he has *zero* points on special teams. Zip. Zilch. Nada. The eye test has also been awful for him, and I feel as if Ilya's almost afraid to handle the puck at times whenever I see him in possession of the puck.

His $4.75M AAV contact is simply not worthwhile. And you can't really say that he's just getting back into it after the major injury he suffered previously, especially when he came out of the gates running this season. I'm not sure if it's lingering effects of his ACL injury or if something has gotten to his head somehow, but this man is simply not a good fit for the team anymore and he needs to go.

If the team elects to buyout Mikheyev, we save **$3.6M** of cap space right away next season, effectively negating the OEL cap penalty for next year (**$2.346M**) and then some. In 2025-26, we would then save **$2.6M** of cap space, which dampens the **$4.766M** cap penalty from OEL that year. This would then be followed by **$1.55M** of dead cap in both '26-27 and '27-28, which would respectively bring the total dead cap space in those years to **$6.316M** and **$3.676M**.

Logistically speaking, I think it makes more sense than a Dickinson-esque trade where we gambit another valuable draft pick and we can also bank on the salary cap to keep rising quite high throughout the remainder of the decade anyways thanks to factors such as the ESPN deal, so this wouldn't sting quite as bad in the later years.",2024-04-04 05:22:40,2024-04-04,new
Hot Take(?): Panarin and Kucherov should be the front Runners for Hart ,https://www.reddit.com/r/nhl/comments/1bvdnq5/hot_take_panarin_and_kucherov_should_be_the_front/,0,nhl,"If we’re talking most valuable it’s really hard to not say they’re not the the most valuable players to the their teams this year.

On Colorado, the second leading point scorer is Rantanen with 100+ points 

On Edmonton, Draisatil is second on the team in points with 99 

On Toronto Second on the team in points is Nylander with 95 points 

On Tampa the second leading point scorer is Point with 83 points 

On the Rangers the second leading point scorer is Trocheck with 75 points 


Now with Ted Lindsay it should and will be McDavid, Kucherov and MacKinnon. They’re the 3 best players in the league this year and there is a difference between best and most valuable. I’m sure the Hart will also be those 3 guys and I have no issue with that because they’re all amazing and superstar players, all so damn exciting to watch but I think the Hart shouldn’t just go to the three top point scorers, it’s not always the top 3 every year anyway ",2024-04-04 03:55:32,2024-04-04,new
Oilers allow 4 goals in 5 minutes ,https://www.reddit.com/r/nhl/comments/1bvd40p/oilers_allow_4_goals_in_5_minutes/,78,nhl,"McDavid needs to request a trade 
",2024-04-04 03:27:10,2024-04-04,new
Mikko Rantanen or Leon Draisaitl?  Pick…with a twist!,https://www.reddit.com/r/nhl/comments/1bvd1ix/mikko_rantanen_or_leon_draisaitl_pickwith_a_twist/,0,nhl,"Tell me who you’d rather have by trashing the other player as legitimately as possible. Proof goes a long way. 

No comparisons. Just trash the shit outta the guy you wouldn’t want. ",2024-04-04 03:23:46,2024-04-04,new
Fan view of Devils vs. Rangers line brawl.,https://v.redd.it/qzczwljkpdsc1,581,nhl,,2024-04-04 03:07:24,2024-04-04,new
TNT studio reaction to NY vs NJ,https://v.redd.it/0d0wvownjdsc1,2001,nhl,,2024-04-04 02:33:47,2024-04-04,new
"Matt Rempe has completed the hattrick, he has been ejected in all 3 games he has played against the Devils😂",https://i.redd.it/29wvzogghdsc1.jpeg,1106,nhl,,2024-04-04 02:20:37,2024-04-04,new
In remembrance..Joe Flaherty,https://youtu.be/VmaG3qb1Saw?si=8ZNEmXRoCaj9se7U,22,nhl,Not to mention John Candy,2024-04-04 02:16:27,2024-04-04,new
Kuch was awarded an assist on this play. A great example of why secondary assists need to be examined when considering the Hart this year,https://streambug.io/cv/4c4db3,0,nhl,,2024-04-04 02:10:47,2024-04-04,new
Real,https://i.redd.it/y6a3lczaddsc1.jpeg,917,nhl,,2024-04-04 01:57:20,2024-04-04,new
"All Streaming Questions here (NHL.TV, Sportsnet, NBC, ESPN, etc.... ) NO ILLEGAL STREAMS, 2023-24 Season",https://www.reddit.com/r/nhl/comments/16fgiv9/all_streaming_questions_here_nhltv_sportsnet_nbc/,76,nhl,"The sub can be banned by reddit admins as other subs have been if we allow illegal streams. This isn't my decision, this is because of how reddit admins have banned other subs for being hubs of illegal streaming. I don't want the same here.

With the new season about to get started, lets put all your posts about legal streams here.",2023-09-11 00:17:40,2023-09-11,hot
Ekholm deletes Rantanen,https://v.redd.it/5d66gmyfursc1,400,nhl,,2024-04-06 02:38:52,2024-04-06,hot
The NHL needs to bring the playoff decal back this year,https://i.redd.it/59xhwsd26rsc1.jpeg,306,nhl,"The last few playoffs just haven’t felt the same without it, they haven’t had one since 2019 (technically 2020) and the playoffs from 2021-23 haven’t felt the same without it. I could understand why we didn’t have it in 2021 (we were honestly lucky we even got a season)  2022-23 there was no excuse to not have imo and it needs to make it’s return this year. I’m tiered of playoff hockey feeling like it’s still the regular season.",2024-04-06 00:21:42,2024-04-06,hot
A slick goal off the goalie's face mask.,https://v.redd.it/rzsn64ltdpsc1,423,nhl,,2024-04-05 22:32:39,2024-04-05,hot
Blue cheese or go f*** your mother,https://i.redd.it/jif57fvyynsc1.png,1504,nhl,,2024-04-05 13:50:07,2024-04-05,hot
Playoff race in the East rn,https://i.redd.it/19ojhmwwprsc1.jpeg,120,nhl,,2024-04-06 02:12:57,2024-04-06,hot
NHL (VGK) player declared legally dead before trade deadline expects to be ready for Playoffs,https://thebeaverton.com/2024/04/nhl-player-declared-legally-dead-before-trade-deadline-expects-to-be-ready-for-playoffs/,1427,nhl,"Golden Knights player Connor Holmdenberg has announced he will be ready to play in Game 1 of the upcoming Stanley Cup Playoffs, despite the fact that he (and his 6.7 million dollar cap hit) was declared deceased by the team right before the NHL’s annual trade deadline back in March.

“Obviously when we reported to the league that Connor would need to be placed on LTIR due to his having passed away we did not expect him to be back in time for the playoffs,” said Knights GM Kelly McCrimmon. “But, thanks to Connor’s hard work and the expertise of our medical staff, we’re pleased to report that he will be alive again in time to help us chase another championship.”

“He definitely will still be dead during our last regular season game when the Salary Cap still exists though. That’s important to remember.”",2024-04-05 11:51:43,2024-04-05,hot
Will he break 100…?,https://i.redd.it/qojypgddgpsc1.jpeg,273,nhl,,2024-04-05 18:35:55,2024-04-05,hot
#851,https://v.redd.it/ipve75193rsc1,90,nhl,,2024-04-06 00:05:58,2024-04-06,hot
New Artemi Panarin reference just dropped,https://v.redd.it/6vn7s39iyqsc1,61,nhl,,2024-04-05 23:39:43,2024-04-05,hot
Zach Benson’s stick explodes as he tries to end the game with an empty netter,https://x.com/sabresplays/status/1776420298595684483?s=46&t=EUQhUmF7oONsaf4ogDZu3w,25,nhl,,2024-04-06 01:45:36,2024-04-06,hot
"You're a GM, and this summer you get job offers from Buffalo, Ottawa, and Montreal. Which one are you taking? ",https://www.reddit.com/r/nhl/comments/1bwnbry/youre_a_gm_and_this_summer_you_get_job_offers/,91,nhl,,2024-04-05 17:07:36,2024-04-05,hot
Shane Wright scores back to back goals,https://v.redd.it/hbduuolv1ssc1,14,nhl,,2024-04-06 03:21:14,2024-04-06,hot
Straight Savage,https://v.redd.it/rnki1438xjsc1,1644,nhl,,2024-04-05 00:00:32,2024-04-05,hot
Vegas gave up 6 goals in the 3rd period to the Yotes,https://i.redd.it/0hn76e45hssc1.jpeg,6,nhl,,2024-04-06 04:45:34,2024-04-06,hot
Coyotes Gameday Cover 04052023,https://i.redd.it/8hszd94d3psc1.jpeg,60,nhl,,2024-04-05 17:23:45,2024-04-05,hot
Moments taken before disaster,https://www.reddit.com/gallery/1bx2yqr,7,nhl,,2024-04-06 04:43:06,2024-04-06,hot
Jonathan Drouin has officially crossed the 50 point threshold!,https://www.reddit.com/r/nhl/comments/1bwj5kz/jonathan_drouin_has_officially_crossed_the_50/,79,nhl,"What a season for him as he has 51 points in 73 games (17 g, 34 a) with a +/- of 11. Who knows if he resigns with the team as he may have priced himself out of COL like Burakovsky, Kadri, Rodrigues in the past
",2024-04-05 14:16:21,2024-04-05,hot
What wild card be lookin’ like in the west,https://i.redd.it/v1uhg2zr9ssc1.jpeg,5,nhl,,2024-04-06 04:04:17,2024-04-06,hot
Top 10 photos taken moments before disaster,https://i.redd.it/0ngxu7x4gssc1.jpeg,4,nhl,,2024-04-06 04:39:57,2024-04-06,hot
Nick Foligno’s sons at Blackhawks practice,https://v.redd.it/gma037mujisc1,1828,nhl,,2024-04-04 19:22:58,2024-04-04,hot
#849,https://v.redd.it/duyegf8tbksc1,580,nhl,,2024-04-05 01:21:50,2024-04-05,hot
Clint Malarchuk,https://i.redd.it/wylyq8o0gnsc1.jpeg,83,nhl,,2024-04-05 11:50:22,2024-04-05,hot
Anybody else Google NHL scores showing 6-2 for oilers?,https://www.reddit.com/r/nhl/comments/1bx12ml/anybody_else_google_nhl_scores_showing_62_for/,5,nhl,,2024-04-06 03:01:56,2024-04-06,hot
Bring back NHL 1-8 Playoff format! ,https://www.reddit.com/r/nhl/comments/1bwyrmw/bring_back_nhl_18_playoff_format/,7,nhl,https://chng.it/GsFpZHxPgH,2024-04-06 01:07:55,2024-04-06,hot
Sabres Please Give Me Hope,https://www.reddit.com/r/nhl/comments/1bx1p7e/sabres_please_give_me_hope/,4,nhl,Jesus christ we beat the Capitols and now the Flyers. For the love of God don't let this be false hope again. Just make it to play offs. You don't have to win just make it to play offs. That's all I ask.,2024-04-06 03:35:09,2024-04-06,hot
"Ryan: Forget about Charlie, Joel is your real brother! (Or a straight-up clone)",https://i.redd.it/72ag9xsr6psc1.png,24,nhl,,2024-04-05 17:49:46,2024-04-05,hot
Seems accurate,https://i.redd.it/mu3b49dmaksc1.jpeg,473,nhl,,2024-04-05 01:14:46,2024-04-05,hot
Just over 12 minutes left…,https://www.reddit.com/r/nhl/comments/1bx2xfg/just_over_12_minutes_left/,3,nhl,What the hell happened Vegas? You were up 4-1. ,2024-04-06 04:40:59,2024-04-06,hot
Plot twist,https://i.redd.it/8caf2l02dlsc1.jpeg,244,nhl,,2024-04-05 04:50:13,2024-04-05,hot
45 goals left to tie Gretzky,https://v.redd.it/n0qkdhfnmksc1,370,nhl,,2024-04-05 02:22:47,2024-04-05,hot
Best arena in your opinion and why?,https://www.reddit.com/r/nhl/comments/1bwxlbd/best_arena_in_your_opinion_and_why/,3,nhl,Just curious lol,2024-04-06 00:12:43,2024-04-06,hot
#850,https://v.redd.it/3uw3raix2rsc1,3,nhl,,2024-04-06 00:04:20,2024-04-06,hot
Why are the Canadiens eliminated but not the Senators? Why are either eliminated? Both can achieve 84 points and the last wildcard team only has 83 points.,https://i.redd.it/0vzjsr3zkmsc1.png,61,nhl,,2024-04-05 08:57:16,2024-04-05,hot
Coyotes’ new home,https://v.redd.it/5hrogdkfvksc1,166,nhl,,2024-04-05 03:11:43,2024-04-05,hot
Who has the best story for the Bill Masterson trophy?,https://www.reddit.com/r/nhl/comments/1bwt7ak/who_has_the_best_story_for_the_bill_masterson/,5,nhl,"With the NHL releasing the nominees for the Masterton trophy today, it got me wondering. Who won the trophy with the most incredible show of perseverance, sportsmanship and dedication? (Those last words are from the NHL)  
 And maybe, who didn't win but absolutely deserved to win?

&#x200B;",2024-04-05 21:09:48,2024-04-05,hot
NHL All Goat Game ,https://i.redd.it/bh0kjafivjsc1.jpeg,216,nhl,,2024-04-04 23:50:04,2024-04-04,hot
2010-11 Blackhawks that would still be second all time WIOS,https://i.redd.it/6vm5bufgissc1.jpeg,1,nhl,"Franchise hockey manager
(WIOS:Wiks in one season) 
kane had 112 points and toews has 56 plus minus",2024-04-06 04:52:58,2024-04-06,hot
No way wtf.   ...we had it ,https://www.reddit.com/r/nhl/comments/1bx31v4/no_way_wtf_we_had_it/,1,nhl,Wtf happen last quarter    did our goalie choke last quarter ,2024-04-06 04:48:03,2024-04-06,hot
Carlsson masterclass,https://v.redd.it/oykctqr0gssc1,1,nhl,,2024-04-06 04:40:04,2024-04-06,hot
Stories behind the Masterton Trophy nominees?,https://www.reddit.com/r/nhl/comments/1bwtyd0/stories_behind_the_masterton_trophy_nominees/,3,nhl,Anyone know the stories behind the players nominated? Surprised the [nhl.com article](https://www.nhl.com/news/2023-2024-masterton-trophy-nominations-announced) doesn't have that.,2024-04-05 21:39:38,2024-04-05,hot
Oilers defense masterclass,https://v.redd.it/6xznimie7hsc1,862,nhl,,2024-04-04 14:51:37,2024-04-04,hot
Stamkos takes out Hagel with big hit,https://v.redd.it/n92nr1tpgksc1,92,nhl,,2024-04-05 01:49:20,2024-04-05,hot
Dave Maloney throwing shade.,https://www.reddit.com/r/nhl/comments/1bx03hz/dave_maloney_throwing_shade/,1,nhl,"So during breaks in the game, MSG does, ""A Day In The Life of Steve Valiquette"" basically showing him setting up his stats for the game, etc. It's a commercial for CDW but about all the tech Vali uses.

After they come back from a break tonight, the legendary broadcaster Sam Rosen says to the legendary Blueshirt Dave Maloney (who was standing in for Joe Micheletti - Sorry for your loss Joe),   

""So Dave, would you like to live a day in the life of Steve Valiquette?""  
Dave replies, ""Cmon now. He's a goalie. What's going on up there?""   

LMAO

I will say this though, Valiquette is ridiculous with the stats, in a good way. ;)

PS, I was a goalie back in the day. Dave is right. We're really not all together up there.",2024-04-06 02:13:06,2024-04-06,hot
High end 07 player!,https://www.eliteprospects.com/player/947876/ricky-kwarciak,0,nhl,,2024-04-06 04:23:04,2024-04-06,hot
Vegas is looking good if you don't look at that first period shots on goal.,https://i.redd.it/x9s6qj6o6ssc1.png,0,nhl,,2024-04-06 03:47:43,2024-04-06,hot
Does anyone know where to find this?,https://i.redd.it/zutdyt1zvqsc1.jpeg,2,nhl,Saw someone on tiktok found this at the NHL shop in NYC and was wondering if anyone knows if it’s for sale on any website?,2024-04-05 23:25:08,2024-04-05,hot
My friend's view of the Rags-Devils fight,https://v.redd.it/4vc2pi7wgjsc1,90,nhl,,2024-04-04 22:28:47,2024-04-04,hot
NYI and PIT looking at WAS,https://i.redd.it/smh2kcgzeksc1.jpeg,49,nhl,,2024-04-05 01:39:13,2024-04-05,hot
Blacked Out,https://www.reddit.com/r/nhl/comments/1bx0cl1/blacked_out/,0,nhl,"Ducks v Kraken blacked out on the Center Ice package here in the Coachella Valley, 125+ miles, and a separate TV market, from LA. Usually not a problem as we would watch the Ducks broadcast via Bally Sports on Spectrum. BUT the Ducks are on KCOP, a local broadcast channel in LA, tonight  and not available on Spectrum here in the Coachella Valley. So Ducks fans here are out of luck AND Kraken fans who pay for the Center Ice package are also screwed. Idiots!",2024-04-06 02:25:31,2024-04-06,hot
How do I watch the DET / NYR game in Ontario ? ,https://www.reddit.com/r/nhl/comments/1bwv4l1/how_do_i_watch_the_det_nyr_game_in_ontario/,1,nhl,"This black out horse shit is getting old !!!! 

I live an hour from Detroit in Ontario. I want to watch this game tonight ….. any suggestions ?!? ",2024-04-05 22:26:22,2024-04-05,hot
Ottawa goaltending,https://v.redd.it/rkssn8qw7ksc1,51,nhl,,2024-04-05 00:59:49,2024-04-05,hot
Coyotes new arena/entertainment district concept,https://v.redd.it/6jqbgzrodnsc1,7,nhl,,2024-04-05 11:37:56,2024-04-05,hot
"When I first read this, I genuinely thought his life was in danger",https://i.redd.it/8n5gy6kuvgsc1.jpeg,343,nhl,,2024-04-04 13:46:38,2024-04-04,hot
Interesting start to the Devils vs Rangers game.,https://v.redd.it/ax1wx31hkcsc1,4111,nhl,,2024-04-03 23:15:53,2024-04-03,hot
Player's preference ,https://www.reddit.com/r/nhl/comments/1bwrdjy/players_preference/,0,nhl,"I know all NHL players are competitive, they wouldn't be pros if they weren't. However, only 50% of the 32 teams make it to the playoffs. 

Which do you think most players really prefer, a chance at playing potentially 16-28 additional games before they start their shortened off-season break or enjoy their summer in their home/countries recovering from a grueling 8 month workload? ",2024-04-05 19:55:17,2024-04-05,hot
"Metro is tight, who do you think will make it?",https://i.redd.it/03jkzhqa2lsc1.png,19,nhl,,2024-04-05 03:50:46,2024-04-05,hot
TNT studio reaction to NY vs NJ,https://v.redd.it/0d0wvownjdsc1,2003,nhl,,2024-04-04 02:33:47,2024-04-04,hot
Some conspiracy sheet going on if the scores turns out this way,https://www.reddit.com/gallery/1bx16rk,0,nhl,Google is doing some weird shit,2024-04-06 03:08:03,2024-04-06,hot
"Stamkos hits teammate, Eyssimont jumps Xhekaj",https://v.redd.it/cz1utlqtlksc1,26,nhl,,2024-04-05 02:18:42,2024-04-05,hot
Can Ryan Huska and Pierre McGuire get a DNA test please?,https://i.redd.it/nouy3reyhksc1.jpeg,25,nhl,,2024-04-05 01:55:53,2024-04-05,hot
If I Owned Each NHL Franchise.,https://www.reddit.com/r/nhl/comments/1bx17v4/if_i_owned_each_nhl_franchise/,0,nhl,"Things I Would Change If I Owned Each Team.


ANA: Bring back old logo/jerseys.

ARI: Leave (Go To QC).

BOS: Give C to Pasta.

BUF: Arena upgrades, bring back Goat logo.

CGY: New arena, make Blasty main logo.

CAR: New branding, downtown arena

CHI: Keep logo, Black jerseys.

COL: Jersey upgrade

CBJ: More canons.

DAL: New Logo/Jerseys.

DET: Bring back old goal horn

EDM: Bring back cog jersey as alt.

FLA: New Miami arena

LAK: Bring back yellow/purple logo.

MIN: Jersey upgrades.

MTL: Arena exterior upgrades.

NSH: New jerseys

NJD: Jersey upgrades.

NYI: Jersey upgrades.

NYR: Liberty jersey as alternate.

OTT: Downtown arena.

PHI: Downtown arena.

PIT: Get back Fleury.

SJS: Arena Upgrades. Maybe move to SF.

SEA: Metropolitan jersey alternate.

STL: Add Gateway Arch to logo.

TBL: Jersey/logo upgrades

TOR: no

VAN: Arena upgrades, Skate jersey.

VGK: Better management.

WSH: New arena and branding.

WPG: Bigger arena, New jerseys.


Feel Free To Criticize Or Add Something.",2024-04-06 03:09:45,2024-04-06,hot
Why do aging NHL players go play in Swiss Leagues?,https://www.reddit.com/r/nhl/comments/1bvqvp5/why_do_aging_nhl_players_go_play_in_swiss_leagues/,117,nhl,"I’m a noob to hockey and am just wondering why, for example, a player who’s been in the league for 6 years would go play in the Swiss B League after an unsuccessful free agency? 

Do players often come back from these leagues into the NHL? Or maybe it’s just for the love of the game? Some other reason? 

Referring to the player Scott Harrington. Big fan just curious what he’s doing over there. 

Thanks in advance. 


Edit: thanks for the info fam. Sounds like a nice gig.",2024-04-04 16:00:04,2024-04-04,hot
Wtf going on,https://i.redd.it/nf441o40scsc1.jpeg,2011,nhl,,2024-04-03 23:57:57,2024-04-03,hot
"Matt Rempe has completed the hattrick, he has been ejected in all 3 games he has played against the Devils😂",https://i.redd.it/29wvzogghdsc1.jpeg,1113,nhl,,2024-04-04 02:20:37,2024-04-04,hot
Free goal night in Ottawa,https://v.redd.it/pxgpb8ozjlsc1,5,nhl,,2024-04-05 05:29:47,2024-04-05,hot
Playoff viewing. F' the nhl for gatekeeping it,https://www.reddit.com/r/nhl/comments/1bwwmr9/playoff_viewing_f_the_nhl_for_gatekeeping_it/,0,nhl,"How can I watch the playoffs??? WTF. The NHL isn't the NFL or MLB. Don't they want a new younger fan base? Let us watch it without all the shit. I have a lot of the streaming services, including YTTV and Paramount, hulu (not premium), etc but cannot watch the playoffs. WTF 

Gain viewership before you become an a\*#",2024-04-05 23:29:13,2024-04-05,hot
Real,https://i.redd.it/y6a3lczaddsc1.jpeg,912,nhl,,2024-04-04 01:57:20,2024-04-04,hot
Fan view of Devils vs. Rangers line brawl.,https://v.redd.it/qzczwljkpdsc1,580,nhl,,2024-04-04 03:07:24,2024-04-04,hot
Reaves and Jeannot drop the mitts!,https://v.redd.it/xzyu5xr76dsc1,744,nhl,,2024-04-04 01:17:39,2024-04-04,hot
Capitals' Tom Wilson Opens Up About High Stick On Leafs' Noah Gregor,https://thehockeynews.com/nhl/washington-capitals/takes/washington-capitals-tom-wilson-noah-gregor-suspension-appeal,62,nhl,,2024-04-04 12:39:15,2024-04-04,hot
3 out of the 4 refs at the Habs - Lightning game are replacing other refs who couldn't make it because of the storm in Montréal,https://www.reddit.com/r/nhl/comments/1bw25lt/3_out_of_the_4_refs_at_the_habs_lightning_game/,6,nhl,"It's what RDS said, the French canadian broadcast. Thought it was pretty funny.",2024-04-04 23:12:23,2024-04-04,hot
Eastern Wild Card race is wildin’!!!!,https://www.reddit.com/r/nhl/comments/1bw734k/eastern_wild_card_race_is_wildin/,4,nhl,And I’m all here for it!!!!,2024-04-05 02:48:39,2024-04-05,hot
Bold Prediction from Editor-In-Chief: Two teams will make playoffs as second wild card.,https://i.redd.it/82a1ffsblhsc1.png,20,nhl,,2024-04-04 16:12:06,2024-04-04,hot
Jack Edwards,https://www.reddit.com/r/nhl/comments/1bwmbwh/jack_edwards/,0,nhl,"Needs to go immediately.

\-Sad bruins fan anxiously awaiting a first round exit, fulfilling the complete waste of Bergeron, Chara and Marchand's careers (except for one season that Tim Thomas carried)",2024-04-05 16:26:47,2024-04-05,hot
Laviolette vs Green,https://v.redd.it/rfjgb3a1rcsc1,332,nhl,,2024-04-03 23:52:50,2024-04-03,hot
Natural hat trick ,https://www.reddit.com/r/nhl/comments/1bwhpni/natural_hat_trick/,0,nhl,"Quick question as me and some buddies were talking about this the other night. 

If a player (Bob let’s call him) was to score a goal in the first to make it 1-1 or whatever and than the other team scores 2 goals to make it 3-1. Bob were than to go out and score 3 in the third to make it 4-3. would it be considered a natural hat trick even thou he had already scored one previously. 

 or would his three goals together kinda overrule the hatrick and give him a natural hatrick stat ??",2024-04-05 13:13:10,2024-04-05,hot
The NHL has the best product but the worst administration in sports. ,https://www.reddit.com/r/nhl/comments/1bv5xjp/the_nhl_has_the_best_product_but_the_worst/,388,nhl,,2024-04-03 22:09:43,2024-04-03,hot
"What are the impactful differences in duties between Captain and Alternate Captain? Why is it best for a team that a very good and most long tenured player, like Mike Modano, is not designated as the Captain (I know he was but then he got switched back to Alternate)?",https://www.reddit.com/r/nhl/comments/1bw55p3/what_are_the_impactful_differences_in_duties/,2,nhl,Thanks!,2024-04-05 01:20:23,2024-04-05,hot
Playoff format,https://www.reddit.com/r/nhl/comments/1bwgqul/playoff_format/,0,nhl,"If the playoffs were to start today, because Dallas is the highest seed, they would play the lower wild card seed LA (who isn’t in their division), and the other wildcard Nashville (who is in their division) will play Vancouver (same division as LA). Does that make any sense? The highest getting the lowest seed makes sense when both wildcards are from the same division. But the whole point of this playoff format was to have divisional playoffs. Why not do that when the wildcards are from seperate divisions? As a Dallas fan I don’t want late night games in the first round.",2024-04-05 12:26:27,2024-04-05,hot
Playoff format proposal ,https://www.reddit.com/r/nhl/comments/1bwhb4m/playoff_format_proposal/,0,nhl,"League split in 8 divisions of four teams each.

Top two seeds plays each other in first round, winner of the series is considered champion of the division.

The 8 division champions are seeded based on regular season record 1-8, with 1v8, 2v7, 3v6 and 4v5.  

Same for third round highest v lowest, other two teams plays each other.

Last two teams plays in Stanley Cup Finals.

Yes this could introduce long travel in rounds 2 and 3, but vice versa we could have short travel for the finals.  And guaranteed really short travel for the first round.

This encourages rivalries to form outside the division, and potentially have rivalries play each other in the finals.",2024-04-05 12:54:25,2024-04-05,hot
Oilers allow 4 goals in 5 minutes ,https://www.reddit.com/r/nhl/comments/1bvd40p/oilers_allow_4_goals_in_5_minutes/,81,nhl,"McDavid needs to request a trade 
",2024-04-04 03:27:10,2024-04-04,hot
What’s the oldest a hockey player started playing hockey?,https://www.reddit.com/r/nhl/comments/1bw769d/whats_the_oldest_a_hockey_player_started_playing/,0,nhl,"Usually NHL hockey players start off young like 4 or 6, but has there been any hockey players that started when they were in middle school or even high school??",2024-04-05 02:52:32,2024-04-05,hot
Sharks vs Kings camera angle,https://www.reddit.com/r/nhl/comments/1bw73y7/sharks_vs_kings_camera_angle/,0,nhl,Anyone else notice the camera angle isn’t right on TV? Seeing more empty seats than hockey. Maybe they hired a new camera guy? The camera movement is giving me a headache too. ,2024-04-05 02:49:39,2024-04-05,hot
What a MISSILE by Auston Matthews for his 63rd of the season. On pace for 70,https://v.redd.it/im804t35rcsc1,126,nhl,,2024-04-03 23:53:14,2024-04-03,hot
